sourceCode,sourceName,sourceFrequency,sourceAutoAssignedConceptIds,matchScore,mappingStatus,equivalence,statusSetBy,statusSetOn,conceptId,conceptName,domainId,mappingType,comment,createdBy,createdOn,assignedReviewer
966,Enteral infusion of concentrated nutritional substances,32,,0.77,UNCHECKED,UNREVIEWED,,0,4178423,Nasogastric intubation for enteral infusion of concentrated nutritional substances,Procedure,MAPS_TO,,<auto>,1733477953275,
3995,Hemodialysis,9,,1.00,UNCHECKED,UNREVIEWED,,0,4120120,Hemodialysis,Procedure,MAPS_TO,,<auto>,1733477953316,
3950,Angioplasty of other non-coronary vessel(s),3,,0.50,UNCHECKED,UNREVIEWED,,0,4184832,Coronary angioplasty,Procedure,MAPS_TO,,<auto>,1733477953429,
3129,Other permanent tracheostomy,1,,0.91,UNCHECKED,UNREVIEWED,,0,4065590,Permanent tracheostomy,Procedure,MAPS_TO,,<auto>,1733477953491,
3607,Insertion of drug-eluting coronary artery stent(s),1,,0.84,UNCHECKED,UNREVIEWED,,0,44789455,Insertion of drug-eluting coronary artery stent,Procedure,MAPS_TO,,<auto>,1733477953661,
